{
  "_id": "66f2b3c4d5e6f7a8b9c0d1e4",
  "schema_version": 1,
  "entity_id": "66f2b3c4d5e6f7a8b9c0d1e2",
  "version_no": 2,
  "parent_version_id": "66f2b3c4d5e6f7a8b9c0d1e3",
  "restored_from_version_id": null,
  "content": {
    "type": "number",
    "title": "年龄（周岁）",
    "description": "用于跨问卷的年龄分布统计",
    "required": true,
    "validation": {
      "integer": true,
      "min": 0,
      "max": 120
    }
  },
  "content_hash": "28c828cb4393e87795dfcf1c59111de66e33002d98c1cfaa6e6d296ca01e9a91",
  "created_by": "651f1c2a9b3e4d5f6a7b8c9d",
  "created_at": "2026-10-20T09:30:00Z",
  "legacy_key": null
}
